{
  "release": true,
  "warning_shown": "sha256:abababababababababababababababababababababababababababababababab",
  "record": {
    "artifact": "sha256:abababababababababababababababababababababababababababababababab",
    "ui_build": "sha256:cdcdcdcdcdcdcdcdcdcdcdcdcdcdcdcdcdcdcdcdcdcdcdcdcdcdcdcdcdcdcdcd"
  },
  "step_up": {
    "assertion_id": "asr_01JBH3C0Q0",
    "authenticated_at": "2026-10-08T14:30:00.000000000Z",
    "method": "passkey"
  }
}
